Column1,Dnum,Country,State,County,Age,Formation,Stage,Age_Date,AmmoniteZone,LocDescr,Resume_of_Fauna,IndexFossil,Collector,Date,EandR,Map,USGS7.5,Lat_Pub,Long_Pub,Reference,Comments,last_modified,Orig_Resume_Fauna,FieldNum,FormationNew
864,266,USA,CO,Jefferson,Cretaceous,"Pierre shale, lower part","Campanian, Middle  80.04 MY",NA,,"NWSESW sec.15, T.6S., R.69W., ",Baculites obtusus,Baculites obtusus,G.R. Scott,11/19/1954,EG-55-1D,Littleton ,,39.52421,-105.10507,,,02/18/2014,Baculites obtusus,,Pierre
865,267,USA,CO,Jefferson,Cretaceous,"Pierre shale, lower part","Campanian, Middle  80.04 MY",NA,,"NWSESW sec.15, T.6S., R.69W., ",Baculites obtusus,,G.R. Scott,11/19/1954,EG-55-1D,Littleton ,,39.52421,-105.10507,PP 483-E,,02/18/2014,Baculites obtusus,,Pierre
866,1799,USA,CO,Grand,Cretaceous,"Pierre shale, lower part",,NA,,"West side of U.S. Highway 40, in NW1/4 SE1/4 sec. 12, T. 2 N., R. 81 W., ",Baculites,,"G.R. Scott, W. A. Cobban",06/12/1958,,Kremling 3 ,Hinman Reservoir,40.1613,-106.4136,,,02/18/2014,Baculites,,Pierre
867,5399,USA,CO,Grand,Cretaceous,"Pierre Shale, lower part",,NA,,"NW¼NE¼ sec. 9, T. 1 N., R. 80 W.",Inoceramus sp.,,G. A. Izett,1966,CD-66-24D,Kremmling,Kremmling,40.06829,-106.35932,,,02/18/2014,Inoceramus sp.,,Pierre
868,5402,USA,CO,Grand,Cretaceous,"Pierre Shale, lower part",,NA,,"E½NE¼ sec. 36, T. 1½ N., R. 81 W.","Inoceramus cf. I. subcompressus Meek & Hayden, Cymbophora sp., Baculites cf. B. gilberti Cobban, Scaphites sp.",,G. A. Izett,1966,CD-66-24D,Kremmling,Kremmling,40.0893,-106.412,,,02/18/2014,"Inoceramus cf. I. subcompressus Meek & Hayden, Cymbophora sp., Baculites cf. B. gilberti Cobban, Scaphites sp.",,Pierre
869,5408,USA,CO,Grand,Cretaceous,"Pierre Shale, lower part",,NA,,"SE¼NW¼ sec. 20, T. 1 N., R. 80 W",Inoceramus cf. I. proximus Tuomey,,G. A. Izett,1966,CD-66-24D,Kremmling,Kremmling,40.0369,-106.3846,,,02/18/2014,Inoceramus cf. I. proximus Tuomey,,Pierre
870,832,USA,CO,Jefferson,Cretaceous,"Pierre shale, lower than D831","Campanian, Middle  80.04 MY",NA,,"East shore of Ralston Reservior ,in the SW1/4SE1/4NE1/4 sec. 5,T.3 S., R. 70 W.",Baculites obtusus.,,R.Van Horn,05/08/1956,,Golden ,Golden,39.8235,-105.247,,,02/18/2014,Baculites obtusus.,GF-76,Pierre
873,12414,USA,CO,Larimer,Cretaceous,"Pierre Shale, possibly base of transition member",,NA,,"NW cor. SW1/4 SW1/4 sec. 30, T. 11 N., R. 68 W.","Nucula (Pectinucula) cancellata (Meek and Hayden), Cymbophora canonensis (Meek) ",,G.R. Scott,10/28/1983,CRG-83-21D,Round Butte  ,,40.88788,-105.05617,,,02/18/2014,"Nucula (Pectinucula) cancellata (Meek and Hayden), Cymbophora canonensis (Meek) ",,Pierre
882,2939,USA,CO,Boulder,Cretaceous,Pierre shale. From yellow is. comcr.,,NA,,"Gully NW1/4SE1/4SW1/4 sec. 31, T. 2 N., R. 70 W.",Scaphites,,W. A. Cobban,05/11/1961,0,Boulder ,,40.09005,-105.27656,,,02/18/2014,Scaphites,,Pierre
883,2905,USA,WY,Niobrara,Upper Cretaceous,Pierre Shale. Prominent bed of closely-spaced gray is. Concrs. Near top of Pseudo-sharon Spring Member,"Campanian, Lower. about 80.9 MY",NA,,"SW1/4SE1/4 & center of SE1/4 & NW1/4SE1/4 sec. 23 and NW1/4NE1/4 sec. 26, T. 38 N., R. 62 W.",Baculites smooth sp.,,"L.G. schultz, J.R.Gill, W.A. Cobban",09/09/1960,0,,,43.25351,-104.26938,PP 393,,02/18/2014,Baculites smooth sp.,,Pierre
884,3790,USA,CO,Boulder,Cretaceous,Pierre Shale. Reddish brown ironstone concretions in olive gray clayey shale,"Campanian, Middle  80.04 MY",NA,,"Cut of irrigation ditch in NE1/4 SE1/4 sec. 7, T. 2 N., R. 70 W.","Baculites obtusus, Inoceramus",Inoceramus azerbaidjanensis,G.R. Scott,5/22/1962,,Lyons ,,40.15035,-105.266,,,02/18/2014,"Baculites obtusus, Inoceramus",,Pierre
885,6728,USA,CO,Elbert,Cretaceous,Pierre Shale. Transsition member.,,NA,,"NW¼ sec.10, T.9S., R.57W.",Crenella sp.,,"G.R.Scott, Joseph A. Sharps",5/23/1968,SR-68-10D,,,39.28381,-103.76697,,,02/18/2014,Crenella sp.,,Pierre
886,6729,USA,CO,Elbert,Cretaceous,Pierre Shale. Transsition member.,,NA,,"Road cut in the SE¼ sec.25, T.8S., R.58W",Sphenodiscus sp.,Sphenodiscus-Coahuilites,Scott & Sharps,5/23/1968,SR-68-10D,,,39.32014,-103.83037,,,02/18/2014,Sphenodiscus sp.,,Pierre
32,2594,USA,WY,Sweetwater,Cretaceous,Approximately 100-150 feet below top of Rock Springs formation.,Campanian,NA,,"SE1/4 sec. 14, T. 17 N., R. 105 W., Sweetwater Co., WY.","Ostrea russelli Landes, Cymella montanensis Henderson, Ethmocardium whitei Dall, Legumen ellipticum Conrad, Medionapus? Sp., Baculites haresi Reeside, Placenticeras syrtale (Morton)",,J. H. Smith,1960,0,,,41.44841,-109.21915,,,02/18/2014,"Ostrea russelli Landes, Cymella montanensis Henderson, Ethmocardium whitei Dall, Legumen ellipticum Conrad, Medionapus? Sp., Baculites haresi Reeside, Placenticeras syrtale (Morton)",,Rock Springs
34,2597,USA,WY,Sweetwater,Cretaceous,Approximately 325 feet above base of Rock Springs formation.,Campanian,NA,,"NW1/4 sec. 6, T. 17 N., R. 104 W., Sweetwater Co., WY.","Anomia micronema Meek, Corbula subtrigonalis Meek & Hayden, Corbula undifera Meek, Melania insculpta Meek Wood with mollusk borings",,J. H. Smith,1960,0,,,41.4845,-109.19039,,,02/18/2014,"Anomia micronema Meek, Corbula subtrigonalis Meek & Hayden, Corbula undifera Meek, Melania insculpta Meek Wood with mollusk borings",,Rock Springs
35,2596,USA,WY,Sweetwater,Cretaceous,Approximately 380 feet above base of Rock Springs formation.,Campanian,NA,,"SE1/4 sec. 6, T. 17 N., R. 104 W., Sweetwater Co., WY.",Corbula undifera Meek,,J. H. Smith,1960,0,,,41.47705,-109.18072,,,02/18/2014,Corbula undifera Meek,,Rock Springs
68,3419,USA,WY,,Cretaceous,Buff 6 - to 8 - foot sandstone above coaly unit and about 100 feet below top of Rock Springs Formation,Campanian,NA,,"N1/2 sec. 23, T. 17 N., R. 105 W.","Ethmocardium ursaniense Landes, Baculites sp.",,"A. D. Zapp, W. A. Cobban",08/07/1961,"OF-61-3D, 5D",,,41.44147,-109.22439,,,02/18/2014,"Ethmocardium ursaniense Landes, Baculites sp.",,Rock Springs
891,10181,USA,WY,Sweetwater,Cretaceous,Rock Springs Fm,Campanian,NA,,Sec. 19 T19N R101W,Corbula undifera,,H.W. Roehler,1977,0,,,41.61022,-108.84004,,,02/18/2014,Corbula undifera,,Rock Springs
892,4928,USA,WY,,Cretaceous,"Rock Springs Fm., about top of Coulson Member.",Campanian,NA,,Same locality as D3419,Corbula,,W. A. Cobban,07/09/1965,,,,41.44147,-109.22439,,,02/18/2014,Corbula,,Rock Springs
893,2571,USA,WY,,Cretaceous,"Rock Springs formation, 700-735 feet above base.",Campanian,NA,,"SE1/4NW1/4SW1/4 sec. 13, T. 17 N., R. 105 W.","Ostrea russelli Landes, Ethmocardium whitei Dall, Legumen ellipticum Conrad, Tellina equilateralis Meek and Hayden, Leptosolen biplicatus Conrad, Baculites haresi Reeside, Placenticeras syrtale (Morton)",,J. H. Smith,05/01/1960,0,,,41.44925,-109.21072,,,02/18/2014,"Ostrea russelli Landes, Ethmocardium whitei Dall, Legumen ellipticum Conrad, Tellina equilateralis Meek and Hayden, Leptosolen biplicatus Conrad, Baculites haresi Reeside, Placenticeras syrtale (Morton)",,Rock Springs
894,10570,USA,WY,Sweetwater,Cretaceous,"Rock Springs Formation, 740 feet above base ",Campanian,NA,,"NW1/4 sec. 12, T. 19 N., R. 102 W., ","Brachidontes laticostata (White), Anomia micronema Meek, Crassostrea sp.",,Dawn Madden,1978,CMR-78-12D,Point of Rocks ,,41.64271,-108.86542,,,02/18/2014,"Brachidontes laticostata (White), Anomia micronema Meek, Crassostrea sp.",,Rock Springs
895,3962,USA,WY,Sweetwater,Cretaceous,"Rock Springs Formation, from an unnamed sandstone unit 530 feet below base of Ericson Formation.",Campanian,NA,,"Sec. 30, T. 18 N., R. 101 W.",Placenticeras syrtale (Morton),,J. H. Smith,1963,,,,41.50864,-108.8403,,,02/18/2014,Placenticeras syrtale (Morton),,Rock Springs
896,10567,USA,WY,Sweetwater,Cretaceous,"Rock Springs Formation, from very fine grained sandstone 376 feet above base ",Campanian,NA,,"NW1/4 sec. 14, T. 19 N., R. 102 W., ","Brachidontes laticostata (White), Crassostrea sp., Corbula undifera Meek, Dircella sp.",,Dawn Madden,1978,CMR-78-12D,Thayer Junction,,41.62913,-108.88259,,,02/18/2014,"Brachidontes laticostata (White), Crassostrea sp., Corbula undifera Meek, Dircella sp.",,Rock Springs
897,10568,USA,WY,Sweetwater,Cretaceous,"Rock Springs Formation, from very fine grained sandstone 740 feet above base ",Campanian,NA,,"NW1/4 sec. 12, T. 19 N., R. 102 W., ","Brachidontes laticostata (White), Anomia micronema Meek, Crassostrea sp.",,Dawn Madden,1978,CMR-78-12D,Point of Rocks ,,41.64271,-108.86542,,,02/18/2014,"Brachidontes laticostata (White), Anomia micronema Meek, Crassostrea sp.",,Rock Springs
902,13985,USA,TX,Presidio,Cretaceous,San Carlos formation.,Campanian,NA,,"Porvenir area, western Presidio Co. Polaris Cemetary",Cyprimeria roddai Young,,Wollaben [J.P. Conlin],,0,,,30.41707,-104.85223,,,02/18/2014,Cyprimeria roddai Young,,San Carlos
116,5570,USA,WY,Carbon,Cretaceous,"Cody Shale, 150 ft below serrate sandstone","Campanian, Lower about 80.5 MY",NA,,"SW¼ sec. 17, T. 23 N., R. 86 W.","Inoceramus cf. I. proximus Tuomey, Pteria n. sp., Baculites sp. (weak flank ribs)",,J. R. Gill,9/21/1966,OF-66-3D,Rawlins NW,,41.96084,-107.13379,,,02/18/2014,"Inoceramus cf. I. proximus Tuomey, Pteria n. sp., Baculites sp. (weak flank ribs)",,Serrate
119,5568,USA,WY,Carbon,Cretaceous,"Cody Shale, 200 ft below serrate sandstone",Campanian,NA,,"SW¼ sec. 17, T. 23 N., R. 86 W.","Thyasira sp., Baculites sp.,",,Gill and Reiskind,9/21/1966,OF-66-3D,Rawlins NW,,41.96084,-107.13379,,,02/18/2014,"Thyasira sp., Baculites sp.,",,Serrate
124,5572,USA,WY,Carbon,Cretaceous,"Cody Shale, 449 ft above serrate sandstone",Campanian,NA,,"SW¼ sec. 17, T. 23 N., R. 86 W.",Baculites sp.,,J. R. Gill,9/21/1966,OF-66-3D,Rawlins NW,,41.96084,-107.13379,,,02/18/2014,Baculites sp.,,Serrate
265,5563,USA,WY,Carbon,Cretaceous,"Cody Shale, from top of Serrate sandstone; 8th sandstone below Mesaverde",Campanian,NA,,"SE¼NW¼SW¼ sec. 7, T. 23 N., R. 86 W.","Inoceramus sp., Tellina sp.",,Gill and Reiskind,09/09/1966,OF-66-3D,Rawlins NW ,,41.97579,-107.15418,,,02/18/2014,"Inoceramus sp., Tellina sp.",,Serrate
424,6254,USA,WY,Carbon,cretaceous,From second Sandstone above the serrate sandstone,"Campanian, Middle",NA,,"SE¼ sec. 8, T. 22 N., R. 86 W.",Baculites mclearni Landes,,Jame R. Gill,1967,OF-67-7D,,,41.88865,-107.12373,,,02/18/2014,Baculites mclearni Landes,,Serrate
426,6298,USA,WY,Carbon,Cretaceous,From serrate sandstone zone; in 20- ft unit of interlaminated sandstone and shale below a 1-ft bentonite .,"Campanian, Middle  80.04 MY",NA,,"NE¼SW¼SE¼ sec. 35, T.21 N., R. 85 W.",Baculites obtusus Meek,,Bergman,08/02/1967,OF-67-7D,Savage Ranch ,,41.74279,-106.95089,,,02/18/2014,Baculites obtusus Meek,,Serrate
432,2589,USA,WY,Carbon,Cretaceous,From the Serrate sandstone 395 feet below top of Steele shale. ,"Campanian, Middle  80.04 MY",NA,,"Station 1, in the NW1/4 sec. 24, T. 25 N., R. 87 W.","Inoceramus sp., (discarded), Baculites obtusus Meek",,R. L. Rioux ,1960,0,Ferris,,42.12687,-107.18758,,,02/18/2014,"Inoceramus sp., (discarded), Baculites obtusus Meek",,Serrate
469,5571,USA,WY,Carbon,Cretaceous,"Haystack Mountains Fm.O'Briain Spring Sandstone Mbr.  [Cody Shale, near top of serrate sandstone]","Campanian, Middle  80.04 MY",NA,,"SW¼ sec. 17, T. 23 N., R. 86 W.",Baculites obtusus Meek,,J. R. Gill,9/21/1966,OF-66-3D,Rawlins NW,,41.96084,-107.13379,PP 667,,02/18/2014,Baculites obtusus Meek,,Serrate
472,6081,USA,WY,Carbon,Cretaceous,"Haystack Mountains Formation, below the base of the Serrate sandstone and bentonite","Campanian, Lower. about 80.9 MY",NA,,"NE¼NE¼ sec. 12, T. 23 N., R. 86 W.","Inoceramus sp., Baculites sp. (smooth)",,E.A. Merewether,06/04/1967,OF-67-8D,Rawlins NW ,,41.98449,-107.04423,,,02/18/2014,"Inoceramus sp., Baculites sp. (smooth)",,Serrate
482,6101,USA,WY,Carbon,Cretaceous,"Haystack Moutains Formation, 100-150 ft below Serrate sandstone",Campanian,NA,,"NW¼NW¼ sec. 31, T. 24 N., R. 86 W.",Trachy scaphites praespiniger Cobban and Scott,,E. A. Merewether,07/01/1967,OF-67-8D,Riddle Cut ,,42.01301,-107.15545,,,02/18/2014,Trachy scaphites praespiniger Cobban and Scott,,Serrate
483,6102,USA,WY,Carbon,Cretaceous,"Haystack Moutains Formation, 130-180 ft below Serrate sandstone","Campanian, Lower. about 80.9 MY",NA,,"NE¼NE¼NE¼ sec. 36, T. 24 N., R. 87 W.","Inoceramus sp., Baculites sp. (smooth)",,E. A. Merewether,07/01/1967,OF-67-8D,Riddle Cut ,,42.01402,-107.15895,,,02/18/2014,"Inoceramus sp., Baculites sp. (smooth)",,Serrate
485,6097,USA,WY,Carbon,Cretaceous,"Haystack Moutains Formation, at top of Serrate sandstone (20-30 ft above D6096)","Campanian, Middle  80.04 MY",NA,,"NW¼SW¼ sec. 31, T. 24 N., R. 86 W.",Baculites obtusus Meek,,E. A. Merewether,6/30/1967,OF-67-8D,Riddle Cut ,,42.00585,-107.1553,,,02/18/2014,Baculites obtusus Meek,,Serrate
486,6096,USA,WY,Carbon,Cretaceous,"Haystack Moutains Formation, in upper part of Serrate sandstone","Campanian, Middle  80.04 MY",NA,,"NW¼SW¼ sec. 31, T. 24 N., R. 86 W.","Ostrea sp., Baculites obtusus Meek",,E. A. Merewether,6/30/1967,OF-67-8D,Riddle Cut,,42.00585,-107.1553,,,02/18/2014,"Ostrea sp., Baculites obtusus Meek",,Serrate
487,6100,USA,WY,Carbon,Cretaceous,"Haystack Moutains Formation, O'Brian Spring Sandstone Mbr.  about 50 ft below Serrate sandstone","Campanian, Middle  80.04 MY",NA,,"NW¼NW¼ sec. 31, T. 24 N., R. 86 W.","Inoceramus sp., Baculites obtusus Meek",,E. A. Merewether,07/01/1967,OF-67-8D,Riddle Cut ,,42.01301,-107.15545,PP 667,,02/18/2014,"Inoceramus sp., Baculites obtusus Meek",,Serrate
488,6109,USA,WY,Carbon,Cretaceous,"Haystack Moutains Formation, probably from upper Serrate sandstone","Campanian, Middle  80.04 MY",NA,,"NE¼NW¼ sec. 34, T. 25 N., R. 86 W.",Baculites obtusus Meek,,E. A. Merewether,07/11/1967,OF-67-8D,Wild Horse Mtn. ,,42.09983,-107.10763,,,02/18/2014,Baculites obtusus Meek,,Serrate
489,6098,USA,WY,Carbon,Cretaceous,"Haystack Moutains Formation, within upper part of Serrate sandstone","Campanian, Middle  80.04 MY",NA,,"Center of sec. 20, T. 24 N., R. 86 W.",Baculites obtusus Meek,,E. A. Merewether,6/30/1967,OF-67-8D,Riddle Cut ,,42.03682,-107.12943,,,02/18/2014,Baculites obtusus Meek,,Serrate
964,5484,USA,WY,Carbon,Cretaceous,"Steele Shale, float from below Serrate (?) sandstone",Campanian,NA,,"SE¼NE¼SE¼ sec. 1, T. 24 N., R. 86 W.","Ostrea sp., Baculites cf. B. aquilaensis Reeside",,E. A. Merewether,8/25/1966,OF-66-13D,Wild Horse Mountain ,,42.07772,-107.04265,,,02/18/2014,"Ostrea sp., Baculites cf. B. aquilaensis Reeside",,Serrate
43,3245,USA,WY,Natrona,Cretaceous,Basal ledge of three ledges of Shannon Sandstone Member of Steele Shale.,Campanian,NA,,"NE1/4 sec. 1, T. 40 N., R. 80 W.",Baculites sp.,,W. A. Cobban,9/16/1960,0,Goverenment Creek,,43.46763,-106.40597,,,02/18/2014,Baculites sp.,,Shannon
72,5005,USA,WY,Natrona,Cretaceous,"Cody Sh., 35' below top of Shannon sandstone Mbr.",Campanian,NA,,"NW¼NW¼ sec. 34, T. 40 N., R. 79 W. Salt Creek oil field",Baculites,,J. R. Gill,9/15/1965,,MIdwest,,43.39706,-106.32865,PP 550 B,,02/18/2014,Baculites,,Shannon
146,4265,USA,WY,Johnson,Cretaceous,"Cody Shale, about 15 feet below a 2.8 - foot bentonite bed that underlies Shannon Sandstone Member",Campanian,NA,,"In deep gully in the SE1/4 NE1/4 sec. 26, T. 44 N., R. 82 W.",Baculites sp.,,J. R. Gill,09/05/1963,,,,43.75287,-106.65716,,,02/18/2014,Baculites sp.,,Shannon
163,5832,USA,WY,Carbon,Cretaceous,"Cody Shale, about 50 ft below Shannon.","Campanian, Lower. about 80.9 MY",NA,,"Salt Creek oil field in NW¼ sec. 8, T.39N., R.78 W",Baculites sp. (smooth),,J.R.Gill,06/06/1967,OF-67-3D,Edgerton,,43.3674,-106.24731,,,02/18/2014,Baculites sp. (smooth),,Shannon
177,4266,USA,WY,Johnson,Cretaceous,"Cody Shale, float from lower 40 feet of Shannon Sandstone",Campanian,NA,,"In deep gully SE1/4 NE1/4 sec. 26, T. 44 N., R. 82 W. Same locality as D4265","Baculites sp., Hoploscaphites? n. sp.",,"R. Burkholder, W. A. Cobban",09/05/1963,,,,43.75287,-106.65716,,,02/18/2014,"Baculites sp., Hoploscaphites? n. sp.",,Shannon
178,5840,USA,WY,Natrona,Cretaceous,"Cody Shale, from  first bed of ironstones above Shannon about 90 ft above Shannon",Campanian,NA,,"W½NE¼SW¼ sec. 34,T.40 N., R.79 W.",Baculites sp. (weakly ribbed),,Gill & Cobban,06/05/1967,OF-67-3D,Edgerton,,43.38985,-106.32492,,,02/18/2014,Baculites sp. (weakly ribbed),,Shannon
190,5834,USA,WY,Carbon,Cretaceous,"Cody Shale, from base of Shannon Sandstone Member.","Campanian, Lower. about 80.9 MY",NA,,"Salt Creek oil field in NW¼ sec. 8, T.39N., R.78 W",Baculites sp. (smooth),,J.R.Gill,06/06/1967,OF-67-3D,Edgerton,,43.3674,-106.24731,,,02/18/2014,Baculites sp. (smooth),,Shannon
250,5837,USA,WY,Natrona,Cretaceous,"Cody Shale, from small  gray limestone concretions 38 ft above shannon","Campanian, Lower. about 80.9 MY",NA,,"NE¼NW¼ sec. 3, T.39 N., R.79W",Baculites sp. (smooth),,W.A. Cobban,06/05/1967,OF-67-3D,Edgerton,,43.38262,-106.32326,,,02/18/2014,Baculites sp. (smooth),,Shannon
251,5839,USA,WY,Natrona,Cretaceous,"Cody Shale, from small  gray limestone concretions about 55 ft above Shannon.",Campanian,NA,,"NE¼NW¼ sec. 3, T.39 N., R.79W",Baculites sp. (weakly ribbed),,W.A. Cobban,06/05/1967,OF-67-3D,Edgerton,,43.38262,-106.32326,,,02/18/2014,Baculites sp. (weakly ribbed),,Shannon
252,5838,USA,WY,Natrona,Cretaceous,"Cody Shale, from small  limestone concretions 38 ft above Shannon","Campanian, Lower. about 80.9 MY",NA,,"W½NE¼SW¼ sec. 34,T.40 N., R.79 W.",Baculites sp. (smooth),,R.E. Burkholder W.A. Cobban,06/05/1967,OF-67-3D,Edgerton,,43.38985,-106.32492,,,02/18/2014,Baculites sp. (smooth),,Shannon
253,5835,USA,WY,Natrona,Cretaceous,"Cody Shale, from small gray limestone concretions 38 ft above Shannon","Campanian, Lower. about 80.9 MY",NA,,"At Amax Petroleum corp. well no. 10-129 in NE¼ sec.10, T.39 N., R.79 W.",Baculites sp. (smooth),,"Gill, Burkholder,and Cobban",06/05/1967,OF-67-3D,Edgerton,,43.36655,-106.31594,,,02/18/2014,Baculites sp. (smooth),,Shannon
254,5836,USA,WY,Natrona,Cretaceous,"Cody Shale, from small gray limestone concretions 38 ft above Shannon","Campanian, Lower. about 80.9 MY",NA,,"Near Amax Petroleum Corp.well no. 19-41 in NW¼NE¼ sec. 19, T.39 N., R.78 W.",Baculites sp. (smooth),,W.A. Cobban,06/05/1967,OF-67-3D,Edgerton,,43.34025,-106.25964,,,02/18/2014,Baculites sp. (smooth),,Shannon
268,4252,USA,WY,Johnson,Cretaceous,"Cody Shale, from unit with gray limestone concretions below the Shannon Sandstone; 1,445 feet above top of Niobrara Member",Campanian,NA,,"SW/4 SE1/4 sec. 23, T. 44 N., R. 82 W.  . Same locality as D4248",Baculites sp.,,W. A. Cobban,09/05/1963,,,,43.76042,-106.66268,,,02/18/2014,Baculites sp.,,Shannon
275,4287,USA,WY,Johnson,Cretaceous,"Cody Shale, from yellowish - brown calcareous sandstone concretions 25 feet above base of Shannon Sandstone Member (25 feet above base of unit 35 of Hose)",Campanian,NA,,"NW1/4 sec. 13, T. 49 N., R. 83 W.  . Same locality as D4286","Baculites sp., Baculites aquilaensis Reeside, Indoscaphites n. sp.",,"J. R. Gill, R. Burkholder",09/12/1963,,,,44.21975,-106.79649,,,02/18/2014,"Baculites sp., Baculites aquilaensis Reeside, Indoscaphites n. sp.",,Shannon
277,5830,USA,WY,Carbon,Cretaceous,"Cody Shale, from zone of brown-weathering ferrocalcareous concretions about 125 ft below Shannon Sandstone Member.","Campanian, Lower. about 80.9 MY",NA,,"Salt Creek oil field in NW¼ sec. 8, T.39N., R.78 W",Baculites sp. (dominantly smooth),,Gill & Burkholder,06/06/1967,OF-67-3D,Edgerton,,43.3674,-106.24731,,,02/18/2014,Baculites sp. (dominantly smooth),,Shannon
279,5831,USA,WY,Carbon,Cretaceous,"Cody Shale, from zone of small gray limestone concretions 10-15 ft below a prominent bentonite bed that lies about 75 ft below Shannon Sandstone","Campanian, Lower. about 80.9 MY",NA,,"Salt Creek oil field in NW¼ sec. 8, T.39N., R.78 W","Baculites sp. (smooth to slightly ribbed), Scaphites n. sp.",,R.E. Burkholder W.A. Cobban,06/06/1967,OF-67-3D,Edgerton,,43.3674,-106.24731,,,02/18/2014,"Baculites sp. (smooth to slightly ribbed), Scaphites n. sp.",,Shannon
307,3238,USA,WY,Natrona,Cretaceous,Dark-gray limestone concretions in Steele Shale 30-40 feet above Shannon Sandstone Member.,Campanian,NA,,"NE1/4 sec. 5, T. 39 N., R. 78 W.",Baculites  sp.,,J. G. Gill,8/10/61; 1960,0,Edgerton,,43.38154,-106.23775,,,02/18/2014,Baculites  sp.,,Shannon
387,3248,USA,WY,Natrona,Cretaceous,From ironstone concretions in Steele Shale about 100 feet below Shannon Sandstone.,Campanian,NA,,"SE1/4SE1/4 sec. 7, T. 39 N., R. 78 W.","Inoceramus sp., Baculites sp.",,J. G. Gill and L. G. Schultz,9/18/1960,0,Edgerton,,47.33586,-106.25462,,,02/18/2014,"Inoceramus sp., Baculites sp.",,Shannon
455,3203,USA,WY,Natrona,Cretaceous,Gray limestone concretions in Steele Shale 45 feet above Shannon Sandstone Member.,"Campanian, Lower about 80.5 MY",NA,,"E1/2 sec. 10, T. 39 N., R. 79 W","Baculites sp. (weak flank ribs), Acanthoscaphites sp.",,J. G. Gill,8/10/61; 1960,0,Salt Creek,,43.36277,-106.31568,,,02/18/2014,"Baculites sp. (weak flank ribs), Acanthoscaphites sp.",,Shannon
459,3246,USA,WY,Natrona,Cretaceous,"Gray sandy, calcareous in shale unit separating middle coarse glauconnitic sandstone ledge of Shannon from upper ledge of Shannon.",Campanian,NA,ELIASI,"NE1/4 sec. 1, T. 40 N., R. 80 W.","Inoceramus sp., Cymbophora cf. C. holmesi (Meek), Baculites sp., Placenticeras sp.",,"J. G. Gill, L. G. Schultz and W. A. Cobban.",9/16/1960,0,Goverenment Creek,,44.82817,-105.09442,,,02/18/2014,"Inoceramus sp., Cymbophora cf. C. holmesi (Meek), Baculites sp., Placenticeras sp.",,Shannon
540,1585,USA,WY,.Johnson,Cretaceous,Lower Shannon sandstone,Campanian,NA,,"Sec. 13, T. 49 N., R. 83 W. ",Baculites haresi,,H. A. Tourtelot,1956,,,,44.21637,-106.79094,,,02/18/2014,Baculites haresi,,Shannon
909,13614,USA,WY,Carbon,Cretaceous,Shannon Sandstone,"Campanian, Lower. about 80.9 MY",NA,,"NE1/4NE1/4SW1/4 sec. 25, T. 21 N., R. 79 W",Baculites sp (smooth),,Cobban,1993,0,Pine Ridge  ,,41.76132,-106.2391,,,02/18/2014,Baculites sp (smooth),,Shannon
954,3204,USA,WY,Natrona,Cretaceous,Steele Shale 175 feet above Shannon SANDSTONE Member,"Campanian, Lower about 80.5 MY",NA,,"E1/2 sec. 10, T. 39 N., R. 79 W",Baculites sp. (weak flank ribs).,,J. G. Gill,8/10/61; 1960,0,Salt Creek,,43.36277,-106.31568,,,02/18/2014,Baculites sp. (weak flank ribs).,,Shannon
958,1315,USA,WY,Natrona,Cretaceous,"Steele shale, about 100' above Shannon ss, member and 3165' below base of Teapot sandstone",Campanian,NA,,"SW¼NW¼SE¼ sec. 33, T. 33 N., R. 82 W.",Baculites ,,"Horn, Richardson, Cobban, Rioux, Van Sickle, McAndrews, Cserna",05/07/1957,,,,42.78241,-106.68112,,,02/18/2014,Baculites ,7,Shannon
969,13227,USA,WY,Natrona,Cretaceous,"Steele Shale, from alkalied ironstone bearing shale between 2 ft bentonite and Shannon Sandstone ","Campanian, Lower. about 80.9 MY",NA,,"NW1/4 NW1/4 sec. 8, T. 39 N., R. 78 W.",Baculites sp (smooth),,"E. A. Merewether, W. A. Cobban ",9/24/1991,0,Gillam Draw West ,,43.36915,-106.25037,,,02/18/2014,Baculites sp (smooth),,Shannon
1026,3247,USA,WY,Natrona,Cretaceous,Top ledge of three ledges of Shannon Sandstone.,Campanian,NA,,"NE1/4 sec. 1, T. 40 N., R. 80 W.","Baculites sp., Placenticeras sp.",Scaphites whitfieldi,J. G. Gill,9/16/1960,0,Goverenment Creek,,43.46763,-106.40597,,,02/18/2014,"Baculites sp., Placenticeras sp.",,Shannon
1032,4167,USA,WY,Natrona,Cretaceous,Top of Shannon Sandstone,Campanian,NA,," SE1/4 sec. 14, T. 39 N., R. 80 W.",Baculites sp.,,"J. R. Gill, R. Vaughn",07/05/1962,,,,43.3442,-106.41397,,,02/18/2014,Baculites sp.,,Shannon
1064,1584,USA,WY,.Johnson,Cretaceous,Upper Shannon sandstone,Campanian,NA,,"Sec.13, T. 49N., R. 83 W.",Baculites haresi,,H. A. Tourtelot,1956,,,,44.21637,-106.79094,,,02/18/2014,Baculites haresi,,Shannon
56,8155,USA,CO,Mesa,Cretaceous,"Base of Sharon Springs Member of Mancos Shale,","Campanian, Middle  80.04 MY",NA,,"Center of the SW1/4SW1/4 sec. 34, T. 9 S, R. 100 W.",Baculites obtusus Meek,,Gill & McHargue,7/21/1971,OF-71-11D,Corcoran Point,,39.22594,-108.54559,OFR 2006-1326,,02/18/2014,Baculites obtusus Meek,,Sharon Springs
306,3740,USA,SD,Fall River,Cretaceous,Dark Pierre Shale with ferro - calc. Concretions 22' - 25' above uppermost gray limestone concretions of Sharon Springs Member,Campanian,NA,,"Side of hill just east of county road in NW1/4 SW1/4 SE1/4 sec. 32, T. 9 S., R. 5 E.",Baculites,,W. A. Cobban,7/21/1961,,Heppner ,Heppner,43.2196,-103.55403,,,02/18/2014,Baculites,,Sharon Springs
337,2898,USA,SD,Buffalo,Cretaceous,Float below Anisomyon outcrop of Sharon Springs and Gregory members of Pierre Shale.,,NA,,"East bank of Missouri River about 8 miles northwest of Fort Thompson, in the sec. 13, T. 13 N., R. 73 W. [Sec 13 T 108 N R 73W]","Inoceramus sublaevis Hall and Meek, Baculites sp.",,L. G. Schultz,1959,0,,Lower Brule NE,44.15357,-99.53073,,,02/18/2014,"Inoceramus sublaevis Hall and Meek, Baculites sp.",S59-46-F,Sharon Springs
344,1664,USA,SD,Fall River,Cretaceous,Fossils found loose on Sharon Springs member of Pierre shale 180 feet above base.,Campanian,NA,,"Northeast corner of sec. 34, T. 8 S., R. 6 E., Angostura Reservoir quadrangle.",Baculites n. sp.,,J. J. Connor,1957,,Angostura Reservoir,,43.31413,-103.3874,,,02/18/2014,Baculites n. sp.,,Sharon Springs
350,1667,USA,SD,Fall River,Cretaceous,From 120 feet above base of Sharon Springs member of Pierre shale.,Campanian,NA,,"Near center of E1/2 sec. 34, T. 8 S., R. 6 E.","Pteria nebrascana, Baculites cf. B. aquilaensis",,J. J. Connor,1957,,Angostura Reservoir,,43.31118,-103.38573,,,02/18/2014,"Pteria nebrascana, Baculites cf. B. aquilaensis",,Sharon Springs
390,3004,USA,CO,Custer,Cretaceous,From large gray septarian ls. concrs. at top of main buttress at Sharon Springs member of Pierre shale ,Campanian,NA,,"About 1/2 miles southwest of switchback on State Route 96, 1 1/2 miles east of Wetmore in SW1/4 sec. 12, T. 21 S., R. 69 W.","Inoceramus, Baculites ",,W. A. Cobban,6/14/1961,0,,Wetmore,38.2384,-105.0542,Buelah NE,,02/18/2014,"Inoceramus, Baculites ",,Sharon Springs
