Column1,Dnum,Country,State,County,Age,Formation,Stage,Age_Date,AmmoniteZone,LocDescr,Resume_of_Fauna,IndexFossil,Collector,Date,EandR,Map,USGS7.5,Lat_Pub,Long_Pub,Reference,Comments,last_modified,Orig_Resume_Fauna,FieldNum,FormationNew
415,3312,USA,WY,Sheridan,Upper Cretaceous,From ridge-forming sandstone in Cody Shale,"Campanian, Lower about 81.7 MY",NA,,"Near Gill Cattle Company headquarters, in NW1/4 NW1/4 sec. 30, T. 58 N., R. 87 W.","Inoceramus patootensis de Loriol, Baculites aquilaensis Reeside, Scaphites hippocrepis (Dekay), Parapuzosia bradyi Miller & Youngquist",,"J. R. Gill, L. G. Schultz, W. A. Cobban",9/14/1960,0,,,44.97891,-107.4186,PP 619,,02/18/2014,"Inoceramus patootensis de Loriol, Baculites aquilaensis Reeside, Scaphites hippocrepis (Dekay), Parapuzosia bradyi Miller & Youngquist",,Cody
416,3313,USA,WY,Sheridan,Cretaceous,From ridge-forming sandstone in Cody Shale,"Campanian, Lower",NA,,"Road cut East Twin Creek in SW1/4 SW1/4 sec. 33, T. 58 N., R. 87 W.","Pecten (Syncyclonema) halli Gabb, Cymbophora sp., Baculites aquilaensis Reeside, Scaphite hippocrepsis (DeKay)",,"J. R. Gill, L. G. Schultz, W. A. Cobban",9/14/1960,0,,,44.95377,-107.36183,,,02/18/2014,"Pecten (Syncyclonema) halli Gabb, Cymbophora sp., Baculites aquilaensis Reeside, Scaphite hippocrepsis (DeKay)",,Cody
442,3334,USA,WY,Carbon,Cretaceous,From upper part of upper tongue of Cody Shale of Weimer and Guyton; about 100 feet above CS - 23,Campanian,NA,,"CNW1/4 NE1/4  sec. 3, T. 26 N., R. 89 W.","Micrabacia sp., Perrisonota sp., Tancredia sp., Ethmocardium cf. E. ursaniense Landes",,A. D. Zapp,9/22/1961,"OF-61-3D, 5D",,,42.25972,-107.45212,,,02/18/2014,"Micrabacia sp., Perrisonota sp., Tancredia sp., Ethmocardium cf. E. ursaniense Landes",,Cody
443,3333,USA,WY,Carbon,Cretaceous,From upper tongue of Cody Shale of Weimer and Guyton,Campanian,NA,,"SE1/4 SE1/4 NE1/4  sec. 4, T. 26 N., R. 89 W.","Glycimeris WYensis (Meek), Ethmocardium n. sp",,A. D. Zapp,9/22/1961,"OF-61-3D, 5D",,,42.25573,-107.40699,,,02/18/2014,"Glycimeris WYensis (Meek), Ethmocardium n. sp",,Cody
458,3336,USA,WY,Carbon,Cretaceous,Gray sandy limestone concretions in upper tongue of Cody Shale of Weimer and Guyton but higher than D3335,Campanian,NA,,"NE1/4 NE1/4  sec. 29, T. 27 N., R. 89 W.","Bryozoan, Solemya sp., Nucula cf. N. cancellata Meek & Hayden, Anomia raetiformis Meek",,"A. D. Zapp, W. A. Cobban",08/06/1961,"OF-61-3D, 5D",,,42.28839,-107.48653,,,02/18/2014,"Bryozoan, Solemya sp., Nucula cf. N. cancellata Meek & Hayden, Anomia raetiformis Meek",,Cody
467,5549,USA,WY,Carbon,Cretaceous,"Haystack Mountains Fm. [Cody Shale, from 5 ft sandstone 90 ft below ""H"" sandstone]",Campanian,NA,,"NW 1/4 sec. 23, T. 22 N., R. 86 W.","Nucula sp., Ostrea sp.",,J. R. Gill,8/20/1966,OF-66-3D,,,41.86726,-107.07525,PP 667,,02/18/2014,"Nucula sp., Ostrea sp.",,Cody
516,9255,USA,WY,Park,Cretaceous ,Lower part of Cody Shale,Campanian,NA,,"Rock Creek in the N1/2 SE1/4 NE1/4 sec. 8, T. 50 N., R. 104 W.",Baculites codyensis Reeside,,E.A Merewether ,8/874,OER-74-19D,Wapiti   ,,44.32348,-109.38077,,,02/18/2014,Baculites codyensis Reeside,,Cody
517,9256,USA,WY,Park,Cretaceous ,Lower part of Cody Shale,Campanian,NA,,"Rock Creek in the NW1/4 NE1/4 SE1/4 sec. 8, T. 50 N., R. 104 W.","Phelopteria sp, Inoceramus sp, Anomia subquadrata Stanton, Crassatella sp, Pholadomya papyracea Meek and Hayden, Baculites codyensis Reeside, Scaphites sp, Crab",,E.A Merewether ,8/874,OER-74-19D,Wapiti   ,,44.3198,-109.38182,,,02/18/2014,"Phelopteria sp, Inoceramus sp, Anomia subquadrata Stanton, Crassatella sp, Pholadomya papyracea Meek and Hayden, Baculites codyensis Reeside, Scaphites sp, Crab",,Cody
743,4757,USA,WY,Carbon,Cretaceous,"O'Brian Spring Sandstone Mbr. Cody Shale, 1,860 ft below top.","Campanian, Middle  80.04 MY",NA,,"NE¼SW¼ sec. 20, T. 23 N., R. 79W.","Cymbophora holmesi (Meek), Baculities obtusus Meek",Baculites obtusus,James Gill & Givens,07/12/1964,OF-65-2D,,,41.94895,-106.31898,PP 667,,02/18/2014,"Cymbophora holmesi (Meek), Baculities obtusus Meek",,Cody
912,2564,USA,WY,Park,Cretaceous,Small gray ls. Concretion in Cody shale.,Campanian,NA,,"At road junction by Ohio Oil Co.--Gov't well No. 3 in SE1/4NE1/4 sec. 32, .T. 51 N., R. 100 W.",Scaphites binevi ,,W. A. Cobban,6/25/1960,0,Oregon Basin,,44.35105,-108.91254,,,02/18/2014,Scaphites binevi fauna,,Cody
1025,3408,USA,WY,Carbon,Cretaceous,Thin sandstone in Cody Shale estimated 600 feet below base of Mesaverde Formation,"Campanian, Middle  80.04 MY",NA,,"Somewhere near quarter corner between secs. 3 and 4, T. 35 N., R. 85 W.,",Baculites cf. B. obtusus Meek,,A. D. Zapp,9/28/1961,"OF-61-3D, 5D",,,43.03358,-107.02662,,,02/18/2014,Baculites cf. B. obtusus Meek,,Cody
1030,4701,USA,WY,Hot Springs,Cretaceous,Top of Cody Shale,Campanian,NA,,"NE¼NW¼ sec. 13, T. 44 N, R. 95 W. Roncco Mine. Same locality as D4700","Ophiomorpha sp., Ostrea sp. (bored)",,Gill & Givens,1964,OF-64-12D,,,43.78745,-108.20808,PP 550 B,,02/18/2014,"Ophiomorpha sp., Ostrea sp. (bored)",,Cody
1044,4782,USA,WY,Washakie,Cretaceous,Upper Cody Shale,Campanian,NA,,"NW¼ sec. 28, T. 47N., R. 90W.",Baculites ,Scaphites hippocrepis,Gill & Givens,8/24/1964,,,,44.01995,-107.66153,,,02/18/2014,Baculites ,,Cody
1046,14221,USA,WY,Natrona,Cretaceous,Upper part of Cody Shale,Campanian,NA,,"Gully in the NE1/4 sec. 32, T. 39N., R. 78W.",Baculites asperitormis,,R. Burkholder & W.A. Cobban,06/04/1967,,Hermosa NW,,43.30952,-106.23712,,,02/18/2014,,,Cody
1047,14237,USA,WY,Big Horn,Cretaceous,Upper part of Cody Shale,Campanian,NA,,Probably from Alkali anticline northwest of Greybull,Haresiceras,Haresiceras placentiform and H. natronense,Greene,1963,,,,44.62514,-108.31735,,,02/18/2014,,,Cody
1048,3400,USA,WY,Carbon,Cretaceous,Upper part of Cody Shale 45 - 75 feet below lowest sandstone in Cody - Mesaverde transition,"Campanian, Middle  80.04 MY",NA,,"NW1/4 NW1/4 NW1/4 sec. 35, T. 32 N., R. 82 W.",Baculites obtusus Meek,Baculites obtusus,A. D. Zapp,8/25/1961,"OF-61-3D, 5D",,,42.70389,-106.62044,,,02/18/2014,Baculites obtusus Meek,,Cody
1049,3401,USA,WY,Carbon,Cretaceous,"Upper part of Cody Shale, 140 feet below base of CS - 30",Campanian,NA,,"S1/2 SW1/4 SW1/4 sec. 26, T. 32 N., R. 82 W.",Baculites aff. B. aquilaensis Reeside,,A. D. Zapp,9/25/1961,"OF-61-3D, 5D",,,42.70577,-106.63709,,,02/18/2014,Baculites aff. B. aquilaensis Reeside,,Cody
1050,4722,USA,WY,Natrona,Cretaceous,Upper part of Cody Shale.,Campanian,NA,,"NW¼SW¼SW¼ sec.24, T. 33 S.., R. 87 W.","Pinna sp., Inocerasmus cf.I. Balticus Boehm, Baculites aquilaensis Reeside",,Gill & Givens,Aug.1964,OF-64-15D,,,42.81227,-107.21952,,,02/18/2014,"Pinna sp., Inocerasmus cf.I. Balticus Boehm, Baculites aquilaensis Reeside",,Cody
338,14843,USA,CO,La Plata,Cretaceous ,"Float from 6-inch thick, dark gray, orange-weathering, hard, dense limestone, high in the Mancos Shale, probably from the Cortez Member",,NA,,"(UTM  0244236 mE and 4129119 mN, Zone 13S) NE sec. 30, T. 35 N., R. 10, W.,  near the intersection of Roosa Ave. and Cemetery Road,",Cordiceramus sp.,,S. C. Hook,"July 11, 2009",,"Durango, Colorado 1:100,000 Surface Management Status Map (BLM)",,37.27538,-107.8852,,,02/18/2014,,,Cortez
46,9150,USA,MT,Liberty,Cretaceous ,Basal part of Eagle Formation,Campanian,NA,,"East of East Butte in the SW1/4 NW1/4 sec. 13, T. 36 N., R. 5 E.","Inoceramus sp, Cymbophora? sp, Cymella? sp, Internal molds of small pelecypods and gastropods, Baculites sp ",,D. D. Rice ,7/16/1974,OER-74-18D,Bingham Lake   ,Bingham Lake,48.8797,-111.0238,,,02/18/2014,"Inoceramus sp, Cymbophora? sp, Cymella? sp, Internal molds of small pelecypods and gastropods, Baculites sp ",,Eagle
47,11213,USA,MT,Petroleum,Cretaceous,Basal part of Eagle Sandstone ,"Campanian, Lower about 81.7 MY",NA,,"Sec. 19, T. 13 N., R. 27 E.",Scaphites hippocrepis,Scaphites hippocrepis,D. L. Gautier,1980,0,,Winnett South,46.8816,-108.3422,,,02/18/2014,Scaphites hippocrepis,,Eagle
53,11952,USA,WY,Hot Springs,Cretaceous,Base of Eagle Sandstone ,Campanian,NA,,"From 0.8 mile due east of Cedar Creek in SE1/4 sec. 5, T. 7 S., R. 2 E., ","Crassostrea sp., ",,R. G. Tysdal,1982,CMR-82-9D,Ennis ,,45.24935,-111.50063,,,02/18/2014,"Crassostrea sp., ",,Eagle
69,2238,USA,MT,Meagher,Cretaceous,Cardium sandstone. Top of Eagle sandstone,Campanian,NA,,"About 100 feet east of road and about 525 feet south of NW cor. Sec. 23, T. 9 N., R. 11 E.,  Top of Eagle sandstone","Cardium (Ethmocardium), Pteria n. sp. Linquaeformis, Pteria (Oxytoma) nebrascana, Cardium (Ethmocardium) whitei",,"W. J. McMannis, C. E. Erdmann",10/26/1959,,,,46.53287,-110.31476,,,02/18/2014,"Cardium (Ethmocardium), Pteria n. sp. Linquaeformis, Pteria (Oxytoma) nebrascana, Cardium (Ethmocardium) whitei",,Eagle
313,4281,USA,MT,Yellowstone,Cretaceous,"Eagle Formation, from ledge of concretionary sandstone 12 feet above base","Campanian, Lower about 81.7 MY",NA,SCOTTI,"E1/2  sec. 5, T. 2 S., R. 29 E.","Inoceramus cf. I. balticus Boehm, Pteria n. sp., Baculites cf. B. asper Morton, Scaphites hippocrepis (DeKay)",,"R. Burkholder, W. A. Cobban",09/11/1963,,,Woody Mountain NW,45.6854,-108.16128,,,02/18/2014,"Inoceramus cf. I. Balticus Boehm, Pteria n. sp., Baculites cf. B. asper Morton, Scaphites hippocrepis (DeKay)",,Eagle
314,11953,USA,WY,Hot Springs,Cretaceous,Eagle Sandstone ,Campanian,NA,,"NE1/4 NE1/4 sec. 8, T. 7 S., R. 2 E., ","Crassostrea sp, Cymbophora sp.",,R. G. Tysdal,1982,CMR-82-9D,Sphinx Mountain ,,45.24415,-111.49797,,,02/18/2014,"Crassostrea sp, Cymbophora sp.",,Eagle
315,3112,USA,MT,Park,Cretaceous,Eagle Sandstone (about 150' above),Campanian,NA,,"Base of lowest exposed sandstone ridge about 600' south of island in Yellowstone River- 1.2 miles east of Gadiner, Yellowstone National Park. 61-F-121","Ostrea sp. Meek, Cymophora cf., C. utahensis (Meek)",,George D. Fraser,1961,0,Gardiner,,45.02435,-110.6785,,,02/18/2014,"Ostrea sp. Meek, Cymophora cf., C. utahensis (Meek)",,Eagle
316,3623,USA,MT,Wheatland,Cretaceous,"Eagle Sandstone, 360 feet above base.",Campanian,NA,,"NE1/4 sec. 14, T. 6 N., R. 15 E. ","Nuculana sp., Modiolus? Sp., Cymbophora? Sp., Placenticeras sp.",,James R. Gill,1961,,,,46.27011,-109.81105,,,02/18/2014,"Nuculana sp., Modiolus? Sp., Cymbophora? Sp., Placenticeras sp.",,Eagle
317,2883,USA,MT?,Park,Cretaceous,"Eagle sandstone, 50 feet above first coal.",Campanian,NA,,"First outcrop southeast of Chapman's Ranch along bluff of Yellowstone River in the SW 1/4 sec. 24, T. 9 S., R. 8 E.","Inoceramus sp., Ostrea sp., Brachidontes sp. Cymbophora arenaria (Meek), Corbula sp.",,G. D. Fraser,1960,0,Gardiner ,,45.03034,-110.69655,,,02/18/2014,"Inoceramus sp., Ostrea sp., Brachidontes sp. Cymbophora arenaria (Meek), Corbula sp.",,Eagle
318,3270,USA,MT,Blaine,Cretaceous,"Eagle Sandstone, 701 feet above base and just above the main coal.",Campanian,NA,,"SE1/4NW1/4 sec . 31, T. 23 N., R. 17 E.","Corbula sp. (phosphatis casts), Bits of bones and crabs.",,J. G. Gill,1961,0,,,47.72323,-109.60074,,,02/18/2014,"Corbula sp. (phosphatis casts), Bits of bones and crabs.",,Eagle
319,5643,USA,MT,Petroleum,Cretaceous,"Eagle Sandstone, from a brown sandy concretion about 100 ft below top",Campanian,NA,,"SE¼SE¼ sec. 35, T. 15 N., R. 29 E",Cymella montanensis (Henderson),,Gill and others,7/26/1966,OF-67-1D,,Cat Creek,47.01512,-108.00043,,,02/18/2014,Cymella montanensis (Henderson),,Eagle
320,5644,USA,MT,Petroleum,Cretaceous,"Eagle Sandstone, from conspicuous bed of large tan sandy concretions 82 ft below top","Campanian, Lower. about 80.9 MY",NA,,"SE¼SE¼ sec. 35, T. 15 N., R. 29 E",Baculites sp. (smooth),,Gill and others,7/26/1966,OF-67-1D,,Cat Creek,47.01512,-108.00043,,,02/18/2014,Baculites sp. (smooth),,Eagle
321,5641,USA,MT,Petroleum,Cretaceous,"Eagle Sandstone, from ferruginous concretion 161-176 ft above base",Campanian,NA,,Same locality as D5639 and also beside road near center of sec. 26.,Baculites aquilaensis Reeside,,Gill and others,7/26/1966,OF-67-1D,,Cat Creek,47.03942,-108.01091,,,02/18/2014,Baculites aquilaensis Reeside,,Eagle
322,5639,USA,MT,Petroleum,Upper Cretaceous,"Eagle Sandstone, from gray sandy limestone concretions 6ft above base","Campanian, Lower about 81.7 MY",NA,,"About NE¼NW¼ sec. 26, T. 15 N., R. 29 E.",Scaphites hippocrepis (Dekay),,Gill and others,7/24/1966,OF-67-1D,,Cat Creek,47.03942,-108.01091,PP 619,,02/18/2014,Scaphites hippocrepis (Dekay),,Eagle
323,5645,USA,MT,Petroleum,Cretaceous,"Eagle Sandstone, from soft shaly sandstone concretions 93 ft below top.",Campanian,NA,,"SE¼SE¼ sec. 35, T. 15 N., R. 29 E","Ethmocardium shitei Dall, Legumen sp., Panope sp.",,W.A. Cobban,7/26/1966,OF-67-1D,,,47.01512,-108.00043,,,02/18/2014,"Ethmocardium shitei Dall, Legumen sp., Panope sp.",,Eagle
324,5640,USA,MT,Petroleum,Cretaceous,"Eagle Sandstone, from top of basal 25-ft sandstone ",Campanian,NA,,"About NE¼NW¼ sec. 26, T. 15 N., R. 29 E.",Inoceramus (Sphenoceramus) cf. I. Patootensiformis Seitz,,W.A. Cobban,7/24/1966,OF-67-1D,,Cat Creek,47.03942,-108.01091,,,02/18/2014,Inoceramus (Sphenoceramus) cf. I. Patootensiformis Seitz,,Eagle
325,4220,USA,MT,Yellowstone,Upper Cretaceous,"Eagle Sandstone, from upper 20 feet of lowest (40 feet thick) sandstone.","Campanian, Lower about 81.7 MY",NA,SCOTTI,"NW1/4 SW1/4 sec. 1, T. 2 S., R. 28 E. .","Inoceramus cf. I. balticus Boehm, Baculites aquiaensis Reeside, Scaphites hippocrepis (DeKay), Scaphites aquisgranensis Schluter",Scaphites hippocrepis,J. R. Gill,1962,,,Woody Mountain NW,45.688,-108.2103,PP 619,,02/18/2014,"Inoceramus cf. I. Balticus Boehm, Baculites aquiaensis Reeside, Scaphites hippocrepis (DeKay), Scaphites aquisgranensis Schluter",,Eagle
326,3271,USA,MT,Blaine,Cretaceous,"Eagle Sandstone, from upper pebble zone about 33 feet below top.",Campanian,NA,,"SE1/4NW1/4 sec . 31, T. 23 N., R. 17 E.","Ethmocardium whitei Dall, Tellina equilateralls Meek & Hayden, Cymbophora alta Meek & Hayden.",,J. G. Gill,1961,0,,,47.72323,-109.60074,,,02/18/2014,"Ethmocardium whitei Dall, Tellina equilateralls Meek & Hayden, Cymbophora alta Meek & Hayden.",,Eagle
327,5642,USA,MT,Petroleum,Cretaceous,"Eagle Sandstone, from yellowish sandy limestone concretions 127 ft below top","Campanian, Lower about 81.7 MY",NA,,"SE¼SE¼ sec. 35, T. 15 N., R. 29 E",Scaphites hippocrepis (Dekay),,Gill and others,7/26/1966,OF-67-1D,,Cat Creek,47.01512,-108.00043,,,02/18/2014,Scaphites hippocrepis (Dekay),,Eagle
328,4221,USA,MT,Yellowstone,Upper Cretaceous,"Eagle Sandstone, same level as D4220","Campanian, Lower about 81.7 MY",NA,,"NW1/4 NW1/4 NW1/4 sec. 6, T. 2 S., R. 29 E. .","Inoceramus cf. I. Balticus Boehm, Baculites aquiaensis Reeside, Scaphites hippocrepis (DeKay)",,J. R. Gill,1962,,,,45.6955,-108.3231,PP 619,,02/18/2014,"Inoceramus cf. I. Balticus Boehm, Baculites aquiaensis Reeside, Scaphites hippocrepis (DeKay)",,Eagle
329,583,USA,MT,Park,Cretaceous,Eagle sandstone.,Campanian,NA,,"NE1/4 sec. 26, T. 2 S., R. 8 E.","Inoceramus, Ostrea ",,A.E. Roberts and W.A. Cobban,7/17/1955,F-55-9D,,,45.6407,-110.69694,,,02/18/2014,"Inoceramus, Ostrea ",R-55-3,Eagle
330,4914,USA,MT,Petroleum,Upper Cretaceous,Eagle Sandstone. From lower part and 150' above D4913.,"Campanian, Lower about 81.7 MY",NA,,"Sandstone bluff 3/4-mile east of Winnett, NE1/4SE1/4 sec. 6, T. 14 N., R. 27 E",Scaphites hippocrepis ,Scaphites hippocrepis,W. A. Cobban,7/31/1965,,Winnett section,,47.00383,-108.337185,PP 619,,02/18/2014,Scaphites hippocrepis fauna,,Eagle
331,1607,USA,MT,Meagher,Cretaceous,Eagle sandstone?,,NA,,"NW¼ sec. 17,  T. 7 N., R. 9 E. ","Ostrea subtrigonalis , Anomia micronema, Corbula aff. C. undifera, Corbicula sp., Melania ? sp.",,H. A. Tourtelot,1957,,,Hamen,46.3718,-110.6269,,,02/18/2014,"Ostrea subtrigonalis , Anomia micronema, Corbula aff. C. undifera, Corbicula sp., Melania ? sp.",,Eagle
398,3272,USA,MT,Blaine,Cretaceous,From limestone concretions in shale near top of Eagle Sandstone.,"Campanian, Middle  80.04 MY",NA,,"SE1/4NW1/4 sec . 31, T. 23 N., R. 17 E.",Baculites obtusus Meek.,Baculites obtusus,J. G. Gill,1961,0,,,47.72323,-109.60074,,,02/18/2014,Baculites obtusus Meek.,,Eagle
421,2316,USA,MT,Carbon,Cretaceous,From sandstone at top of Eagle or base of Claggett. ,Campanian,NA,,"Sec. 24, T.3 S., R. 22 E.","Ethmocardium whitei Dall, Legumen ellipticum Conrad, Mactra cf. M. alta Meek and Hayden",,Elmer D. Patterson,1960,,"Montaqua , MT",Montaqua,45.5626,-108.9635,,,02/18/2014,"Ethmocardium whitei Dall, Legumen ellipticum Conrad, Mactra cf. M. alta Meek and Hayden",,Eagle
422,2880,USA,WY?,Park,Cretaceous,From sandstone interbedded with uppermost coals in Eagle sandstone.,Campanian,NA,,1.05 miles east of mouth of Gardner River on south bank of Yellowstone River just south of west end of small island.,Cymbophora arenaria (Meek),,G. D. Fraser,1960,0,Gardiner ,,45.0266,-110.6785,,,02/18/2014,Cymbophora arenaria (Meek),,Eagle
439,3297,USA,WY,Park,Cretaceous,From top of Eagle Sandstone,Campanian,NA,,"SW1/4 NE1/4 sec. 19, T. 58 N., R. 99 W.",Anisomyon? Sp.,,J. R. Gill,1961,0,,,44.99647,-108.85088,,,02/18/2014,Anisomyon? Sp.,,Eagle
1061,9151,USA,MT,Liberty,Cretaceous ,"Upper part of Telegraph Creek Formation, Upper part of Eagle Formation ",Campanian,NA,,"Same locality as D1950, North side of East Butte in the NW1/4 SW1/4 sec. 9, T. 36 N., R. 5 E. Northeast bank of Sherry Coulee in the SE1/4 SW1/4 sec. 8, T. 24 N., R. 13 E.",Baculites thomi Reeside,Baculites thomi,D. D. Rice and W. Stanton ,"7/16/74, 7/24/74",OER-74-18D,"Bingham Lake, Eagle Buttes   ",Bingham Lake,48.8797,-111.0238,,,02/18/2014,Baculites thomi Reeside,,Eagle
1068,2881,USA,WY?,Park,Cretaceous,Uppermost part of Eagle sandstone.,Campanian,NA,,0.9 mile east-southeast of mouth of Gardner River on south bank of Yellowstone River about 0.2 mile west of small island in river.,"Inoceramus sp., Ostrea cf. O. soleniscus Meek, Anomia sp.",,G. D. Fraser,1960,0,Gardiner ,,45.02764,-110.68242,,,02/18/2014,"Inoceramus sp., Ostrea cf. O. soleniscus Meek, Anomia sp.",,Eagle
54,4634,USA,WY,Park,Cretaceous,Base of Elk Basin Sandstone.,Campanian,NA,,"NW¼SW¼SE¼ sec. 26, T. 58 N, R. 103 W., Same locality as G64-19-3","Inoceramus sp., Baculites haresi Reeside",,Gill and Cobban,9/21/1964,OF-64-14D,,,44.97414,-109.27089,,,02/18/2014,"Inoceramus sp., Baculites haresi Reeside",,Elk Basin
199,4032,USA,WY,Big Horn,Cretaceous,"Cody Shale, from Elk Basin equivalent",Campanian,NA,,"NE1/4 NE1/4 NE1/4 sec. 22, T. 54 N., R. 95 W.","Inoceramus sp., Baculites sp.",,R. L. Rioux,07/01/1963,,,,44.64982,-108.26963,,,02/18/2014,"Inoceramus sp., Baculites sp.",,Elk Basin
200,4030,USA,WY,Big Horn,Cretaceous,"Cody Shale, from equivalent of the Elk Basin Sandstone",Campanian,NA,,"SE1/4 SE1/4 NE1/4 sec. 36, T. 53 N., R. 94 W.","Inoceramus sp., Baculites sp., Placenticeras sp.",,R. L. Rioux,07/01/1963,,,,44.52829,-108.10804,,,02/18/2014,"Inoceramus sp., Baculites sp., Placenticeras sp.",,Elk Basin
334,1446,USA,MT,Carbon,Upper Cretaceous,Elk Basin sandstone Member of Telegrap Creek formation.,Campanian,NA,PLACENTIFORME,"Northwest side of Elk Basin, from conspicuous butte in NW¼SW¼ sec. 35, T. 9 S., R. 23 E","Scaphites, Baculites, Ostrea",Scaphites hippocrepis,W. A. Cobban,8/13/1957,,,,45.68801,-108.21962,PP 619,,02/18/2014,"Scaphites, Baculites, Ostrea",,Elk Basin
335,1445,USA,MT,Carbon,Cretaceous,Elk Basin sandstone Member of Telegraph Creek formation.,Campanian,NA,,"North side of Elk Basin, NW ¼ sec. 35, T. 9 S.,R. 23 E.","Baculites thomi, Scaphites",Scaphites hippocrepis,W. A. Cobban,8/13/1957,,,,45.005,-108.8797,,,02/18/2014,"Baculites thomi, Scaphites",,Elk Basin
999,4641,USA,MT,Carbon,Cretaceous,"Telegraph Creek Formation, 15 feet below Elk Basin Sandstone Member.",Campanian,NA,,"NW¼SE¼ sec. 21, T. 8 S., R. 24 E","Inoceramus cf. I. balticus Boehm, Inoceramus cf. I. proximus Tuomey, Ostrea sp., Baculites haresi Reeside",Scaphites hippocrepis,Gill & Givens,8/27/1964,OF-64-14D,,,45.12302,-108.78848,,,02/18/2014,"Inoceramus cf. I. balticus Boehm, Inoceramus cf. I. proximus Tuomey, Ostrea sp., Baculites haresi Reeside",,Elk Basin
1000,4642,USA,MT,Carbon,Cretaceous,"Telegraph Creek Formation, 15 feet below Elk Basin Sandstone Member.",Campanian,NA,,"SW¼ sec. 27, T. 8 S., R. 24 E","Inoceramus cf. I. balticus Boehm, Baculites sp., Placenticeras planus Hyatt",,Givens,8/27/1964,OF-64-14D,,,45.10719,-108.77524,,,02/18/2014,"Inoceramus cf. I. balticus Boehm, Baculites sp., Placenticeras planus Hyatt",,Elk Basin
1009,4640,USA,MT,Carbon,Cretaceous,"Telegraph Creek Formation, from 2-foot sandstone above 85-foot shale unit below Elk Basin Sandstone Member.",Campanian,NA,,"SW¼ sec. 27, T. 8 S., R. 24 E. Same locality as D4639","Nucula sp., Inoceramus sp., Baculites sp. Fragment of scaphite",,Givens,8/27/1964,OF-64-14D,,,45.10719,-108.77524,,,02/18/2014,"Nucula sp., Inoceramus sp., Baculites sp. Fragment of scaphite",,Elk Basin
1012,4637,USA,MT,Carbon,Upper Cretaceous,"Telegraph Creek Formation, from middle of 80-foot sandy unit 205 feet below Elk Basin Sandstone Member.","Campanian, Lower about 83.8 MY",NA,,"NW¼SE¼ sec. 21, T. 8 S., R. 24 E.","Astarte? Sp., crymbophora? Sp., Baculites thomi Reeside, Scaphites leei Reeside",Baculites thomi,Gill & Givens,8/28/1964,OF-64-14D,,,45.12302,-108.78848,PP 619,,02/18/2014,"Astarte? Sp., crymbophora? Sp., Baculites thomi Reeside, Scaphites leei Reeside",,Elk Basin
1014,4223,USA,MT,Carbon,Cretaceous,"Telegraph Creek Formation, from top of Elk Basin Sandstone Member.",Campanian,NA,,"SW1/4 NE1/4 sec. 26, T. 7 S., R. 23 E.","Inoceramus cf. I. Balticus Boehm, Ostrea sp., Pholadomya aff. P. cupressensis Landes, Baculites thomi Reeside, Placenticeras cf. P. planum Hyatt",Baculites thomi,J. R. Gill,1962,,,,45.1982,-108.8704,,,02/18/2014,"Inoceramus cf. I. Balticus Boehm, Ostrea sp., Pholadomya aff. P. cupressensis Landes, Baculites thomi Reeside, Placenticeras cf. P. planum Hyatt",,Elk Basin
1031,3296,USA,WY,Park,Cretaceous,Top of Elk Basin Sandstone Member of Telegraph Creek Formation.,"Campanian, Lower about 81.7 MY",NA,,"SE1/4 sec . 19, T. 58 N., R. 99 W.","Turritella? Sp., Drepanochilus sp., Baculites thomi Reeside, Scaphites hippocrepis Reeside",Baculites thomi,J. G. Gill,1961,0,,Elk Basin,44.99647,-108.85088,,,02/18/2014,"Turritella? Sp., Drepanochilus sp., Baculites thomi Reeside, Scaphites hippocrepis Reeside",,Elk Basin
174,4171,USA,WY,Natrona,Cretaceous,"Cody Shale, below the Fishtooth Sandstone",Campanian,NA,,"SW1/4 sec. 18, T. 39 N., R. 80 W.",Baculites cf. B. asper Morton,,J. R. Gill,07/08/1962,,,,43.34377,-106.50102,,,02/18/2014,Baculites cf. B. asper Morton,,Fishtooth
311,3198,USA,WY,Natrona,Cretaceous,Dusky-red ironstone in Steele Shale 235 feet above Fishtooth sandstone.,Campanian,NA,,"N1/2 sec. 34, T. 40 N., R. 79 W.",Glyptoxoceras rubeyi (Reeside),,J. G. Gill,8/10/61; 1960,0,Midwest,,43.39521,-106.32127,,,02/18/2014,Glyptoxoceras rubeyi (Reeside),,Fishtooth
312,3199,USA,WY,Natrona,Cretaceous,Dusky-red ironstone in Steele Shale 290 feet above Fishtooth sandstone.,Campanian,NA,,"N1/2 sec. 34, T. 40 N., R. 79 W.",Glyptoxoceras rubeyi (Reeside),,J. G. Gill,8/10/61; 1960,0,Midwest,,43.39521,-106.32127,,,02/18/2014,Glyptoxoceras rubeyi (Reeside),,Fishtooth
363,3244,USA,WY,Natrona,Upper Cretaceous,From a limstone concretions in Steele Shale 35 feet below Fishtooth sandstone.,"Campanian, Lower about 81.7 MY",NA,,"SE1/4 sec. 35, T. 41 N., R. 80 W.","Inoceramus proximus Tuomey, Baculites aquilaensis Reeside, Scaphites hippocrepis (Dekay), Scaphites aquilaensis Reeside",Scaphites hippocrepis,W. A. Cobban,9/16/1990,0,Goverenment Creek,,43.4811,-106.429,PP 619,,02/18/2014,"Inoceramus proximus Tuomey, Baculites aquilaensis Reeside, Scaphites hippocrepis (Dekay), Scaphites aquilaensis Reeside",,Fishtooth
381,3196,USA,WY,Natrona,Cretaceous,From gray limestone concretions in Steele Shale 150 feet below Fishtooth sandstone.,Campanian,NA,,"N1/2 sec. 34, T. 40 N., R. 79 W.","Inoceramus sp., Baculites aquilaensis Reeside",,J. G. Gill,8/10/61; 1960,0,Midwest,,43.39521,-106.32127,,,02/18/2014,"Inoceramus sp., Baculites aquilaensis Reeside",,Fishtooth
382,3200,USA,WY,Natrona,Upper Cretaceous,From gray limestone concretions in Steele Shale 385 feet above Fishtooth sandstone.,"Campanian, Lower about 80.5 MY",NA,,"N1/2 sec. 34, T. 40 N., R. 79 W.","Baculites sp. (weak flank ribs), Scaphites  hippocrepis (Dekay)",,J. G. Gill,8/10/61; 1960,0,Midwest,,43.3947,-106.3223,PP 619,,02/18/2014,"Baculites sp. (weak flank ribs), Scaphites  hippocrepis (Dekay)",,Fishtooth
383,3201,USA,WY,Natrona,Cretaceous,From gray limestone concretions in Steele Shale 405 feet above Fishtooth sandstone.,"Campanian, Lower about 80.5 MY",NA,,"N1/2 sec. 34, T. 40 N., R. 79 W.",Baculites sp. (weak flank ribs),,J. G. Gill,8/10/61; 1960,0,Midwest,,43.39521,-106.32127,,,02/18/2014,Baculites sp. (weak flank ribs),,Fishtooth
384,3197,USA,WY,Natrona,Upper Cretaceous,From gray limestone concretions in Steele Shale 75 feet above Fishtooth sandstone.,"Campanian, Lower about 81.7 MY",NA,,"N1/2 sec. 34, T. 40 N., R. 79 W.","Inoceramus proximus Tuomey, Baculites aquilaensis Reeside, Scaphites hippocrepis (Dekay), Scaphites aquilaensis Reeside",Scaphites hippocrepis,J. G. Gill,8/10/61; 1960,0,Midwest,,43.3947,-106.3223,"PP 667, PP 619",,02/18/2014,"Inoceramus proximus Tuomey, Baculites aquilaensis Reeside, Scaphites hippocrepis (Dekay), Scaphites aquilaensis Reeside",,Fishtooth
388,3202,USA,WY,Natrona,Cretaceous,From ironstone in Steele Shale 440 feet above Fishtooth sandstone.,"Campanian, Lower about 80.5 MY",NA,,"N1/2 sec. 34, T. 40 N., R. 79 W.",Baculites sp. (weak flank ribs),,J. G. Gill,8/10/61; 1960,0,Midwest,,43.39521,-106.32127,,,02/18/2014,Baculites sp. (weak flank ribs),,Fishtooth
